<?xml version="1.0" encoding="utf-8" ?>
<AudioRenderer xmlns:xsi="http://www.w3.org/2001/XMLSchema-instance"
               xsi:schemaLocation="file:///. AudioRenderer.xsd">
  <IO>
    <VolumePort Name="SystemVolume" />
  </IO>
  <AudioChannels>
    <AudioChannel Id="0">
      <SpeakerPort Name="Speaker" />
    </AudioChannel>
    <AudioChannel Id="1">
      <SpeakerPort Name="Speaker1" />
    </AudioChannel>
  </AudioChannels>
  <TextToSpeech>
    <API>Acapela</API>
    <HintPath>..\..\Progs\Acapela</HintPath>
  </TextToSpeech>
</AudioRenderer>